  "No.","Time","Source","Destination","Protocol","Length","Info"
"1","0.000000","10.0.2.15","131.202.240.87","UDP","45","49539  >  53828 Len=3"
"2","0.006108","131.202.240.87","10.0.2.15","UDP","60","53828  >  49539 Len=3"
"3","5.618127","24.140.134.21","10.0.2.15","TCP","68","45411  >  45733 [PSH, ACK] Seq=1 Ack=1 Win=65535 Len=14"
"4","5.618284","10.0.2.15","24.140.134.21","TCP","54","45733  >  45411 [ACK] Seq=1 Ack=15 Win=31136 Len=0"
"5","5.618716","10.0.2.15","24.140.134.21","TCP","58","45733  >  45411 [PSH, ACK] Seq=1 Ack=15 Win=31136 Len=4"
"6","5.618886","24.140.134.21","10.0.2.15","TCP","60","45411  >  45733 [ACK] Seq=15 Ack=5 Win=65535 Len=0"
"7","6.172932","10.0.2.15","64.4.23.162","TCP","88","46839  >  40019 [PSH, ACK] Seq=1 Ack=1 Win=64800 Len=34"
"8","6.173252","64.4.23.162","10.0.2.15","TCP","60","40019  >  46839 [ACK] Seq=1 Ack=35 Win=65535 Len=0"
"9","6.270240","64.4.23.162","10.0.2.15","TCP","60","40019  >  46839 [PSH, ACK] Seq=1 Ack=35 Win=65535 Len=4"
"10","6.270294","10.0.2.15","64.4.23.162","TCP","54","46839  >  40019 [ACK] Seq=35 Ack=5 Win=64800 Len=0"
"11","9.966421","131.202.240.87","10.0.2.15","UDP","77","53828  >  49539 Len=35"
"12","9.967652","10.0.2.15","131.202.240.87","UDP","76","49539  >  53828 Len=34"
"13","10.019678","131.202.240.87","10.0.2.15","UDP","60","53828  >  49539 Len=3"
"14","10.020096","10.0.2.15","131.202.240.87","UDP","45","49539  >  53828 Len=3"
"15","10.871898","10.0.2.15","131.202.240.87","UDP","65","49539  >  53828 Len=23"
"16","10.995931","10.0.2.15","24.140.134.21","TCP","54","45733  >  45411 [FIN, ACK] Seq=5 Ack=15 Win=31136 Len=0"
"17","10.996518","24.140.134.21","10.0.2.15","TCP","60","45411  >  45733 [ACK] Seq=15 Ack=6 Win=65535 Len=0"
"18","10.997022","10.0.2.15","206.75.168.220","TCP","54","38166  >  55632 [FIN, ACK] Seq=1 Ack=1 Win=29200 Len=0"
"19","10.997435","206.75.168.220","10.0.2.15","TCP","60","55632  >  38166 [ACK] Seq=1 Ack=2 Win=65535 Len=0"
"20","10.998381","10.0.2.15","67.71.163.47","TCP","54","35273  >  30582 [FIN, ACK] Seq=1 Ack=1 Win=29200 Len=0"
"21","10.998712","67.71.163.47","10.0.2.15","TCP","60","30582  >  35273 [ACK] Seq=1 Ack=2 Win=65535 Len=0"
"22","11.050116","67.71.163.47","10.0.2.15","TCP","60","30582  >  35273 [FIN, ACK] Seq=1 Ack=2 Win=65535 Len=0"
"23","11.050206","10.0.2.15","67.71.163.47","TCP","54","35273  >  30582 [ACK] Seq=2 Ack=2 Win=29200 Len=0"
"24","11.058134","24.140.134.21","10.0.2.15","TCP","60","45411  >  45733 [FIN, ACK] Seq=15 Ack=6 Win=65535 Len=0"
"25","11.058164","10.0.2.15","24.140.134.21","TCP","54","45733  >  45411 [ACK] Seq=6 Ack=16 Win=31136 Len=0"
"26","11.098937","206.75.168.220","10.0.2.15","TCP","60","55632  >  38166 [FIN, ACK] Seq=1 Ack=2 Win=65535 Len=0"
"27","11.098963","10.0.2.15","206.75.168.220","TCP","54","38166  >  55632 [ACK] Seq=2 Ack=2 Win=29200 Len=0"
"28","20.031013","131.202.240.87","10.0.2.15","UDP","60","53828  >  49539 Len=3"
"29","20.031757","10.0.2.15","131.202.240.87","UDP","45","49539  >  53828 Len=3"
"30","23.148158","10.0.2.15","198.7.63.141","DNS","79","Standard query 0xb2a1 A smtp.googlemail.com"
"31","23.148635","10.0.2.15","78.46.223.24","DNS","79","Standard query 0xb2a1 A smtp.googlemail.com"
"32","23.149189","10.0.2.15","78.46.223.24","DNS","79","Standard query 0xaf44 AAAA smtp.googlemail.com"
"33","23.270406","198.7.63.141","10.0.2.15","DNS","270","Standard query response 0xb2a1 A smtp.googlemail.com CNAME googlemail-smtp.l.google.com A 74.125.207.16 NS ns2.google.com NS ns4.google.com NS ns1.google.com NS ns3.google.com A 216.239.32.10 A 216.239.34.10 A 216.239.36.10 A 216.239.38.10"
"34","23.325710","78.46.223.24","10.0.2.15","DNS","270","Standard query response 0xb2a1 A smtp.googlemail.com CNAME googlemail-smtp.l.google.com A 74.125.206.16 NS ns1.google.com NS ns3.google.com NS ns4.google.com NS ns2.google.com A 216.239.32.10 A 216.239.34.10 A 216.239.36.10 A 216.239.38.10"
"35","23.325789","10.0.2.15","78.46.223.24","ICMP","298","Destination unreachable (Port unreachable)"
"36","23.327607","78.46.223.24","10.0.2.15","DNS","282","Standard query response 0xaf44 AAAA smtp.googlemail.com CNAME googlemail-smtp.l.google.com AAAA 2a00:1450:400c:c04::10 NS ns1.google.com NS ns2.google.com NS ns4.google.com NS ns3.google.com A 216.239.32.10 A 216.239.34.10 A 216.239.36.10 A 216.239.38.10"
"37","23.332586","10.0.2.15","74.125.207.16","TCP","74","48937  >  465 [SYN] Seq=0 Win=29200 Len=0 MSS=1460 SACK_PERM=1 TSval=4220366 TSecr=0 WS=128"
"38","23.382244","74.125.207.16","10.0.2.15","TCP","60","465  >  48937 [SYN, ACK] Seq=0 Ack=1 Win=65535 Len=0 MSS=1460"
"39","23.382316","10.0.2.15","74.125.207.16","TCP","54","48937  >  465 [ACK] Seq=1 Ack=1 Win=29200 Len=0"
"40","23.383703","10.0.2.15","74.125.207.16","TLSv1.2","571","Client Hello"
"41","23.384109","74.125.207.16","10.0.2.15","TCP","60","465  >  48937 [ACK] Seq=1 Ack=518 Win=65535 Len=0"
"42","23.448966","74.125.207.16","10.0.2.15","TLSv1.2","191","Server Hello, Change Cipher Spec, Encrypted Handshake Message"
"43","23.449008","10.0.2.15","74.125.207.16","TCP","54","48937  >  465 [ACK] Seq=518 Ack=138 Win=30016 Len=0"
"44","23.449917","10.0.2.15","74.125.207.16","TLSv1.2","105","Change Cipher Spec, Encrypted Handshake Message"
"45","23.450037","74.125.207.16","10.0.2.15","TCP","60","465  >  48937 [ACK] Seq=138 Ack=569 Win=65535 Len=0"
"46","23.510213","74.125.207.16","10.0.2.15","TLSv1.2","135","Application Data"
"47","23.546098","10.0.2.15","74.125.207.16","TLSv1.2","101","Application Data"
"48","23.546544","74.125.207.16","10.0.2.15","TCP","60","465  >  48937 [ACK] Seq=219 Ack=616 Win=65535 Len=0"
"49","23.600128","74.125.207.16","10.0.2.15","TLSv1.2","294","Application Data"
"50","23.614657","10.0.2.15","74.125.207.16","TLSv1.2","136","Application Data"
"51","23.615764","74.125.207.16","10.0.2.15","TCP","60","465  >  48937 [ACK] Seq=459 Ack=698 Win=65535 Len=0"
"52","23.718864","74.125.207.16","10.0.2.15","TLSv1.2","103","Application Data"
"53","23.727838","10.0.2.15","74.125.207.16","TLSv1.2","125","Application Data"
"54","23.728303","74.125.207.16","10.0.2.15","TCP","60","465  >  48937 [ACK] Seq=508 Ack=769 Win=65535 Len=0"
"55","23.777250","74.125.207.16","10.0.2.15","TLSv1.2","124","Application Data"
"56","23.805645","10.0.2.15","74.125.207.16","TLSv1.2","114","Application Data"
"57","23.805953","74.125.207.16","10.0.2.15","TCP","60","465  >  48937 [ACK] Seq=578 Ack=829 Win=65535 Len=0"
"58","23.867340","74.125.207.16","10.0.2.15","TLSv1.2","124","Application Data"
"59","23.871637","10.0.2.15","74.125.207.16","TLSv1.2","89","Application Data"
"60","23.872381","74.125.207.16","10.0.2.15","TCP","60","465  >  48937 [ACK] Seq=648 Ack=864 Win=65535 Len=0"
"61","24.073086","74.125.207.16","10.0.2.15","TLSv1.2","125","Application Data"
"62","24.106337","10.0.2.15","74.125.207.16","TLSv1.2","899","Application Data"
"63","24.106928","74.125.207.16","10.0.2.15","TCP","60","465  >  48937 [ACK] Seq=719 Ack=1709 Win=65535 Len=0"
"64","24.523642","74.125.207.16","10.0.2.15","TLSv1.2","135","Application Data"
"65","24.529649","10.0.2.15","74.125.207.16","TLSv1.2","89","Application Data"
"66","24.530974","74.125.207.16","10.0.2.15","TCP","60","465  >  48937 [ACK] Seq=800 Ack=1744 Win=65535 Len=0"
"67","24.583152","74.125.207.16","10.0.2.15","TLSv1.2","140","Application Data"
"68","24.584960","74.125.207.16","10.0.2.15","TCP","60","465  >  48937 [FIN, ACK] Seq=886 Ack=1744 Win=65535 Len=0"
"69","24.585950","10.0.2.15","74.125.207.16","TLSv1.2","85","Encrypted Alert"
"70","24.586105","10.0.2.15","74.125.207.16","TCP","54","48937  >  465 [FIN, ACK] Seq=1775 Ack=887 Win=31088 Len=0"
"71","24.586264","74.125.207.16","10.0.2.15","TCP","60","465  >  48937 [ACK] Seq=887 Ack=1775 Win=65535 Len=0"
"72","24.586277","74.125.207.16","10.0.2.15","TCP","60","465  >  48937 [ACK] Seq=887 Ack=1776 Win=65535 Len=0"
"73","24.587734","10.0.2.15","64.233.181.16","TLSv1.2","92","Application Data"
"74","24.588553","64.233.181.16","10.0.2.15","TCP","60","993  >  39536 [ACK] Seq=1 Ack=39 Win=65535 Len=0"
"75","24.668830","64.233.181.16","10.0.2.15","TLSv1.2","99","Application Data"
"76","24.668855","10.0.2.15","64.233.181.16","TCP","54","39536  >  993 [ACK] Seq=39 Ack=46 Win=65535 Len=0"
"77","24.685926","10.0.2.15","64.233.181.16","TLSv1.2","96","Application Data"
"78","24.686347","64.233.181.16","10.0.2.15","TCP","60","993  >  39536 [ACK] Seq=46 Ack=81 Win=65535 Len=0"
"79","24.735579","64.233.181.16","10.0.2.15","TLSv1.2","92","Application Data"
"80","24.736016","10.0.2.15","64.233.181.16","TLSv1.2","121","Application Data"
"81","24.736514","64.233.181.16","10.0.2.15","TCP","60","993  >  39536 [ACK] Seq=84 Ack=148 Win=65535 Len=0"
"82","24.750415","10.0.2.15","64.233.181.16","TLSv1.2","91","Application Data"
"83","24.750972","64.233.181.16","10.0.2.15","TCP","60","993  >  39536 [ACK] Seq=84 Ack=185 Win=65535 Len=0"
"84","25.260316","64.233.181.16","10.0.2.15","TLSv1.2","103","Application Data"
"85","25.271389","10.0.2.15","64.233.181.16","TLSv1.2","93","Application Data"
"86","25.271733","64.233.181.16","10.0.2.15","TCP","60","993  >  39536 [ACK] Seq=133 Ack=224 Win=65535 Len=0"
"87","25.320014","64.233.181.16","10.0.2.15","TLSv1.2","93","Application Data"
"88","25.358259","10.0.2.15","64.233.181.16","TCP","54","39536  >  993 [ACK] Seq=224 Ack=172 Win=65535 Len=0"
"89","25.454581","10.0.2.15","64.233.181.16","TLSv1.2","93","Application Data"
"90","25.455618","64.233.181.16","10.0.2.15","TCP","60","993  >  39536 [ACK] Seq=172 Ack=263 Win=65535 Len=0"
"91","25.506926","64.233.181.16","10.0.2.15","TLSv1.2","93","Application Data"
"92","25.507007","10.0.2.15","64.233.181.16","TCP","54","39536  >  993 [ACK] Seq=263 Ack=211 Win=65535 Len=0"
"93","25.524702","10.0.2.15","64.233.181.16","TLSv1.2","93","Application Data"
"94","25.525179","64.233.181.16","10.0.2.15","TCP","60","993  >  39536 [ACK] Seq=211 Ack=302 Win=65535 Len=0"
"95","25.573994","64.233.181.16","10.0.2.15","TLSv1.2","98","Application Data"
"96","25.577136","10.0.2.15","64.233.181.16","TLSv1.2","97","Application Data"
"97","25.577715","64.233.181.16","10.0.2.15","TCP","60","993  >  39536 [ACK] Seq=255 Ack=345 Win=65535 Len=0"
"98","25.636467","64.233.181.16","10.0.2.15","TLSv1.2","171","Application Data, Application Data, Application Data"
"99","25.640929","10.0.2.15","64.233.181.16","TLSv1.2","98","Application Data"
"100","25.641465","64.233.181.16","10.0.2.15","TCP","60","993  >  39536 [ACK] Seq=372 Ack=389 Win=65535 Len=0"
"101","25.710784","64.233.181.16","10.0.2.15","TLSv1.2","215","Application Data, Application Data, Application Data"
"102","25.750896","10.0.2.15","64.233.181.16","TCP","54","39536  >  993 [ACK] Seq=389 Ack=533 Win=65535 Len=0"
"103","25.803445","10.0.2.15","64.233.181.16","TLSv1.2","93","Application Data"
"104","25.804082","64.233.181.16","10.0.2.15","TCP","60","993  >  39536 [ACK] Seq=533 Ack=428 Win=65535 Len=0"
"105","25.853520","64.233.181.16","10.0.2.15","TLSv1.2","92","Application Data"
"106","25.853547","10.0.2.15","64.233.181.16","TCP","54","39536  >  993 [ACK] Seq=428 Ack=571 Win=65535 Len=0"
"107","30.037560","131.202.240.87","10.0.2.15","UDP","60","53828  >  49539 Len=3"
"108","30.037934","131.202.240.87","10.0.2.15","UDP","82","53828  >  49539 Len=40"
"109","30.041416","10.0.2.15","131.202.240.87","UDP","45","49539  >  53828 Len=3"
"110","30.041750","10.0.2.15","131.202.240.87","UDP","83","49539  >  53828 Len=41"
"111","40.064785","10.0.2.15","131.202.240.87","UDP","45","49539  >  53828 Len=3"
"112","50.083399","10.0.2.15","131.202.240.87","UDP","45","49539  >  53828 Len=3"
"113","53.598328","10.0.2.15","74.125.207.16","TCP","74","48938  >  465 [SYN] Seq=0 Win=29200 Len=0 MSS=1460 SACK_PERM=1 TSval=4227933 TSecr=0 WS=128"
"114","53.651508","74.125.207.16","10.0.2.15","TCP","60","465  >  48938 [SYN, ACK] Seq=0 Ack=1 Win=65535 Len=0 MSS=1460"
"115","53.651568","10.0.2.15","74.125.207.16","TCP","54","48938  >  465 [ACK] Seq=1 Ack=1 Win=29200 Len=0"
"116","53.651965","10.0.2.15","74.125.207.16","TLSv1.2","571","Client Hello"
"117","53.652320","74.125.207.16","10.0.2.15","TCP","60","465  >  48938 [ACK] Seq=1 Ack=518 Win=65535 Len=0"
"118","53.702615","74.125.207.16","10.0.2.15","TLSv1.2","191","Server Hello, Change Cipher Spec, Encrypted Handshake Message"
"119","53.702728","10.0.2.15","74.125.207.16","TCP","54","48938  >  465 [ACK] Seq=518 Ack=138 Win=30016 Len=0"
"120","53.703954","10.0.2.15","74.125.207.16","TLSv1.2","105","Change Cipher Spec, Encrypted Handshake Message"
"121","53.704125","74.125.207.16","10.0.2.15","TCP","60","465  >  48938 [ACK] Seq=138 Ack=569 Win=65535 Len=0"
"122","53.760347","74.125.207.16","10.0.2.15","TLSv1.2","136","Application Data"
"123","53.798304","10.0.2.15","74.125.207.16","TCP","54","48938  >  465 [ACK] Seq=569 Ack=220 Win=30016 Len=0"
"124","53.825762","10.0.2.15","74.125.207.16","TLSv1.2","101","Application Data"
"125","53.827028","74.125.207.16","10.0.2.15","TCP","60","465  >  48938 [ACK] Seq=220 Ack=616 Win=65535 Len=0"
"126","53.883983","74.125.207.16","10.0.2.15","TLSv1.2","294","Application Data"
"127","53.884056","10.0.2.15","74.125.207.16","TCP","54","48938  >  465 [ACK] Seq=616 Ack=460 Win=31088 Len=0"
"128","53.993697","10.0.2.15","74.125.207.16","TLSv1.2","136","Application Data"
"129","53.994033","74.125.207.16","10.0.2.15","TCP","60","465  >  48938 [ACK] Seq=460 Ack=698 Win=65535 Len=0"
"130","54.192455","74.125.207.16","10.0.2.15","TLSv1.2","103","Application Data"
"131","54.192480","10.0.2.15","74.125.207.16","TCP","54","48938  >  465 [ACK] Seq=698 Ack=509 Win=31088 Len=0"
"132","54.205750","10.0.2.15","74.125.207.16","TLSv1.2","125","Application Data"
"133","54.206025","74.125.207.16","10.0.2.15","TCP","60","465  >  48938 [ACK] Seq=509 Ack=769 Win=65535 Len=0"
"134","54.261018","74.125.207.16","10.0.2.15","TLSv1.2","125","Application Data"
"135","54.262078","10.0.2.15","74.125.207.16","TLSv1.2","114","Application Data"
"136","54.263914","74.125.207.16","10.0.2.15","TCP","60","465  >  48938 [ACK] Seq=580 Ack=829 Win=65535 Len=0"
"137","54.311040","74.125.207.16","10.0.2.15","TLSv1.2","125","Application Data"
"138","54.325203","10.0.2.15","74.125.207.16","TLSv1.2","89","Application Data"
"139","54.325959","74.125.207.16","10.0.2.15","TCP","60","465  >  48938 [ACK] Seq=651 Ack=864 Win=65535 Len=0"
"140","54.402322","74.125.207.16","10.0.2.15","TLSv1.2","126","Application Data"
"141","54.406550","10.0.2.15","74.125.207.16","TLSv1.2","950","Application Data"
"142","54.406958","74.125.207.16","10.0.2.15","TCP","60","465  >  48938 [ACK] Seq=723 Ack=1760 Win=65535 Len=0"
"143","54.407017","10.0.2.15","74.125.207.16","TLSv1.2","86","Application Data"
"144","54.407128","74.125.207.16","10.0.2.15","TCP","60","465  >  48938 [ACK] Seq=723 Ack=1792 Win=65535 Len=0"
"145","54.901560","74.125.207.16","10.0.2.15","TLSv1.2","136","Application Data"
"146","54.905085","10.0.2.15","74.125.207.16","TLSv1.2","89","Application Data"
"147","54.905406","74.125.207.16","10.0.2.15","TCP","60","465  >  48938 [ACK] Seq=805 Ack=1827 Win=65535 Len=0"
"148","54.953621","74.125.207.16","10.0.2.15","TLSv1.2","141","Application Data"
"149","54.955297","74.125.207.16","10.0.2.15","TCP","60","465  >  48938 [FIN, ACK] Seq=892 Ack=1827 Win=65535 Len=0"
"150","54.964400","10.0.2.15","64.233.181.16","TLSv1.2","92","Application Data"
"151","54.964799","64.233.181.16","10.0.2.15","TCP","60","993  >  39536 [ACK] Seq=571 Ack=466 Win=65535 Len=0"
"152","54.964877","10.0.2.15","74.125.207.16","TLSv1.2","85","Encrypted Alert"
"153","54.965007","10.0.2.15","74.125.207.16","TCP","54","48938  >  465 [FIN, ACK] Seq=1858 Ack=893 Win=31088 Len=0"
"154","54.965061","74.125.207.16","10.0.2.15","TCP","60","465  >  48938 [ACK] Seq=893 Ack=1858 Win=65535 Len=0"
"155","54.965246","74.125.207.16","10.0.2.15","TCP","60","465  >  48938 [ACK] Seq=893 Ack=1859 Win=65535 Len=0"
"156","55.061681","64.233.181.16","10.0.2.15","TLSv1.2","99","Application Data"
"157","55.061713","10.0.2.15","64.233.181.16","TCP","54","39536  >  993 [ACK] Seq=466 Ack=616 Win=65535 Len=0"
"158","55.086979","10.0.2.15","64.233.181.16","TLSv1.2","99","Application Data"
"159","55.087396","64.233.181.16","10.0.2.15","TCP","60","993  >  39536 [ACK] Seq=616 Ack=511 Win=65535 Len=0"
"160","55.137065","64.233.181.16","10.0.2.15","TLSv1.2","92","Application Data"
"161","55.137410","10.0.2.15","64.233.181.16","TLSv1.2","166","Application Data"
"162","55.138872","64.233.181.16","10.0.2.15","TCP","60","993  >  39536 [ACK] Seq=654 Ack=623 Win=65535 Len=0"
"163","55.144285","10.0.2.15","64.233.181.16","TLSv1.2","91","Application Data"
"164","55.144656","64.233.181.16","10.0.2.15","TCP","60","993  >  39536 [ACK] Seq=654 Ack=660 Win=65535 Len=0"
"165","55.514483","64.233.181.16","10.0.2.15","TLSv1.2","102","Application Data"
"166","55.516038","10.0.2.15","64.233.181.16","TLSv1.2","93","Application Data"
"167","55.516185","64.233.181.16","10.0.2.15","TCP","60","993  >  39536 [ACK] Seq=702 Ack=699 Win=65535 Len=0"
"168","55.563986","64.233.181.16","10.0.2.15","TLSv1.2","93","Application Data"
"169","55.603785","10.0.2.15","64.233.181.16","TCP","54","39536  >  993 [ACK] Seq=699 Ack=741 Win=65535 Len=0"
"170","55.669217","10.0.2.15","64.233.181.16","TLSv1.2","93","Application Data"
"171","55.669658","64.233.181.16","10.0.2.15","TCP","60","993  >  39536 [ACK] Seq=741 Ack=738 Win=65535 Len=0"
"172","55.721307","64.233.181.16","10.0.2.15","TLSv1.2","93","Application Data"
"173","55.721408","10.0.2.15","64.233.181.16","TCP","54","39536  >  993 [ACK] Seq=738 Ack=780 Win=65535 Len=0"
"174","55.725443","10.0.2.15","64.233.181.16","TLSv1.2","93","Application Data"
"175","55.726901","64.233.181.16","10.0.2.15","TCP","60","993  >  39536 [ACK] Seq=780 Ack=777 Win=65535 Len=0"
"176","55.781192","64.233.181.16","10.0.2.15","TLSv1.2","99","Application Data"
"177","55.782060","10.0.2.15","64.233.181.16","TLSv1.2","97","Application Data"
"178","55.782316","64.233.181.16","10.0.2.15","TCP","60","993  >  39536 [ACK] Seq=825 Ack=820 Win=65535 Len=0"
"179","55.842254","64.233.181.16","10.0.2.15","TLSv1.2","141","Application Data, Application Data"
"180","55.845747","10.0.2.15","64.233.181.16","TLSv1.2","98","Application Data"
"181","55.845951","64.233.181.16","10.0.2.15","TCP","60","993  >  39536 [ACK] Seq=912 Ack=864 Win=65535 Len=0"
"182","55.908250","64.233.181.16","10.0.2.15","TLSv1.2","210","Application Data, Application Data, Application Data"
"183","55.946264","10.0.2.15","64.233.181.16","TCP","54","39536  >  993 [ACK] Seq=864 Ack=1068 Win=65535 Len=0"
"184","56.008997","10.0.2.15","64.233.181.16","TLSv1.2","94","Application Data"
"185","56.010240","64.233.181.16","10.0.2.15","TCP","60","993  >  39536 [ACK] Seq=1068 Ack=904 Win=65535 Len=0"
"186","56.071241","64.233.181.16","10.0.2.15","TLSv1.2","92","Application Data"
"187","56.071302","10.0.2.15","64.233.181.16","TCP","54","39536  >  993 [ACK] Seq=904 Ack=1106 Win=65535 Len=0"
"188","60.089756","10.0.2.15","131.202.240.87","UDP","45","49539  >  53828 Len=3"
"189","66.229856","10.0.2.15","64.233.181.16","TLSv1.2","92","Application Data"
"190","66.230326","64.233.181.16","10.0.2.15","TCP","60","993  >  39536 [ACK] Seq=1106 Ack=942 Win=65535 Len=0"
"191","66.565860","64.233.181.16","10.0.2.15","TLSv1.2","94","Application Data"
"192","66.566007","10.0.2.15","64.233.181.16","TCP","54","39536  >  993 [ACK] Seq=942 Ack=1146 Win=65535 Len=0"
"193","66.633378","10.0.2.15","64.233.181.16","TLSv1.2","93","Application Data"
"194","66.633826","64.233.181.16","10.0.2.15","TCP","60","993  >  39536 [ACK] Seq=1146 Ack=981 Win=65535 Len=0"
"195","66.692393","64.233.181.16","10.0.2.15","TLSv1.2","93","Application Data"
"196","66.692418","10.0.2.15","64.233.181.16","TCP","54","39536  >  993 [ACK] Seq=981 Ack=1185 Win=65535 Len=0"
"197","66.704684","10.0.2.15","64.233.181.16","TLSv1.2","93","Application Data"
"198","66.705465","64.233.181.16","10.0.2.15","TCP","60","993  >  39536 [ACK] Seq=1185 Ack=1020 Win=65535 Len=0"
"199","66.757761","64.233.181.16","10.0.2.15","TLSv1.2","96","Application Data"
"200","66.758674","10.0.2.15","64.233.181.16","TLSv1.2","97","Application Data"
"201","66.759233","64.233.181.16","10.0.2.15","TCP","60","993  >  39536 [ACK] Seq=1227 Ack=1063 Win=65535 Len=0"
"202","66.817193","64.233.181.16","10.0.2.15","TLSv1.2","131","Application Data, Application Data"
"203","66.821496","10.0.2.15","64.233.181.16","TLSv1.2","93","Application Data"
"204","66.823235","64.233.181.16","10.0.2.15","TCP","60","993  >  39536 [ACK] Seq=1304 Ack=1102 Win=65535 Len=0"
"205","66.877365","64.233.181.16","10.0.2.15","TLSv1.2","91","Application Data"
"206","66.920618","10.0.2.15","64.233.181.16","TCP","54","39536  >  993 [ACK] Seq=1102 Ack=1341 Win=65535 Len=0"
"207","70.094412","10.0.2.15","131.202.240.87","UDP","45","49539  >  53828 Len=3"
"208","78.367375","64.233.183.16","10.0.2.15","TLSv1.2","131","Application Data, Application Data"
"209","78.367435","10.0.2.15","64.233.183.16","TCP","54","43558  >  993 [ACK] Seq=1 Ack=78 Win=65535 Len=0"
"210","78.369605","10.0.2.15","64.233.183.16","TLSv1.2","91","Application Data"
"211","78.369817","64.233.183.16","10.0.2.15","TCP","60","993  >  43558 [ACK] Seq=78 Ack=38 Win=65535 Len=0"
"212","78.418546","64.233.183.16","10.0.2.15","TLSv1.2","94","Application Data"
"213","78.419142","10.0.2.15","64.233.183.16","TLSv1.2","95","Application Data"
"214","78.419468","64.233.183.16","10.0.2.15","TCP","60","993  >  43558 [ACK] Seq=118 Ack=79 Win=65535 Len=0"
"215","78.468144","64.233.183.16","10.0.2.15","TLSv1.2","94","Application Data"
"216","78.468475","10.0.2.15","64.233.183.16","TLSv1.2","94","Application Data"
"217","78.468620","64.233.183.16","10.0.2.15","TCP","60","993  >  43558 [ACK] Seq=158 Ack=119 Win=65535 Len=0"
"218","78.521422","64.233.183.16","10.0.2.15","TLSv1.2","99","Application Data"
"219","78.522685","10.0.2.15","64.233.183.16","TLSv1.2","95","Application Data"
"220","78.522856","64.233.183.16","10.0.2.15","TCP","60","993  >  43558 [ACK] Seq=203 Ack=160 Win=65535 Len=0"
"221","78.577850","64.233.183.16","10.0.2.15","TLSv1.2","101","Application Data"
"222","78.578156","64.233.183.16","10.0.2.15","TLSv1.2","125","Application Data, Application Data"
"223","78.579414","10.0.2.15","64.233.183.16","TCP","54","43558  >  993 [ACK] Seq=160 Ack=321 Win=65535 Len=0"
"224","78.582532","10.0.2.15","64.233.183.16","TLSv1.2","123","Application Data"
"225","78.582769","64.233.183.16","10.0.2.15","TCP","60","993  >  43558 [ACK] Seq=321 Ack=229 Win=65535 Len=0"
"226","78.640949","64.233.183.16","10.0.2.15","TLSv1.2","101","Application Data"
"227","78.641241","64.233.183.16","10.0.2.15","TLSv1.2","424","Application Data, Application Data, Application Data, Application Data"
"228","78.641375","10.0.2.15","64.233.183.16","TCP","54","43558  >  993 [ACK] Seq=229 Ack=738 Win=65535 Len=0"
"229","78.724969","10.0.2.15","64.233.183.16","TLSv1.2","97","Application Data"
"230","78.725699","64.233.183.16","10.0.2.15","TCP","60","993  >  43558 [ACK] Seq=738 Ack=272 Win=65535 Len=0"
"231","78.803872","64.233.183.16","10.0.2.15","TLSv1.2","1302","Application Data, Application Data, Application Data, Application Data"
"232","78.842798","10.0.2.15","64.233.183.16","TCP","54","43558  >  993 [ACK] Seq=272 Ack=1986 Win=65535 Len=0"
"233","78.891144","10.0.2.15","64.233.183.16","TLSv1.2","97","Application Data"
"234","78.891439","64.233.183.16","10.0.2.15","TCP","60","993  >  43558 [ACK] Seq=1986 Ack=315 Win=65535 Len=0"
"235","78.955295","64.233.183.16","10.0.2.15","TLSv1.2","124","Application Data"
"236","78.955384","10.0.2.15","64.233.183.16","TCP","54","43558  >  993 [ACK] Seq=315 Ack=2056 Win=65535 Len=0"
"237","79.421859","10.0.2.15","74.125.207.16","TCP","74","48939  >  465 [SYN] Seq=0 Win=29200 Len=0 MSS=1460 SACK_PERM=1 TSval=4234388 TSecr=0 WS=128"
"238","79.456218","10.0.2.15","64.233.183.16","TLSv1.2","94","Application Data"
"239","79.456579","64.233.183.16","10.0.2.15","TCP","60","993  >  43558 [ACK] Seq=2056 Ack=355 Win=65535 Len=0"
"240","79.475461","74.125.207.16","10.0.2.15","TCP","60","465  >  48939 [SYN, ACK] Seq=0 Ack=1 Win=65535 Len=0 MSS=1460"
"241","79.475529","10.0.2.15","74.125.207.16","TCP","54","48939  >  465 [ACK] Seq=1 Ack=1 Win=29200 Len=0"
"242","79.475986","10.0.2.15","74.125.207.16","TLSv1.2","571","Client Hello"
"243","79.477856","74.125.207.16","10.0.2.15","TCP","60","465  >  48939 [ACK] Seq=1 Ack=518 Win=65535 Len=0"
"244","79.505565","64.233.183.16","10.0.2.15","TLSv1.2","92","Application Data"
"245","79.505601","10.0.2.15","64.233.183.16","TCP","54","43558  >  993 [ACK] Seq=355 Ack=2094 Win=65535 Len=0"
"246","79.526132","74.125.207.16","10.0.2.15","TLSv1.2","191","Server Hello, Change Cipher Spec, Encrypted Handshake Message"
"247","79.526227","10.0.2.15","74.125.207.16","TCP","54","48939  >  465 [ACK] Seq=518 Ack=138 Win=30016 Len=0"
"248","79.527965","10.0.2.15","74.125.207.16","TLSv1.2","105","Change Cipher Spec, Encrypted Handshake Message"
"249","79.528155","74.125.207.16","10.0.2.15","TCP","60","465  >  48939 [ACK] Seq=138 Ack=569 Win=65535 Len=0"
"250","79.591196","74.125.207.16","10.0.2.15","TLSv1.2","135","Application Data"
"251","79.630349","10.0.2.15","74.125.207.16","TCP","54","48939  >  465 [ACK] Seq=569 Ack=219 Win=30016 Len=0"
"252","79.634814","10.0.2.15","74.125.207.16","TLSv1.2","101","Application Data"
"253","79.635051","74.125.207.16","10.0.2.15","TCP","60","465  >  48939 [ACK] Seq=219 Ack=616 Win=65535 Len=0"
"254","79.689840","74.125.207.16","10.0.2.15","TLSv1.2","294","Application Data"
"255","79.689863","10.0.2.15","74.125.207.16","TCP","54","48939  >  465 [ACK] Seq=616 Ack=459 Win=31088 Len=0"
"256","79.955401","10.0.2.15","74.125.207.16","TLSv1.2","136","Application Data"
"257","79.955853","74.125.207.16","10.0.2.15","TCP","60","465  >  48939 [ACK] Seq=459 Ack=698 Win=65535 Len=0"
"258","80.044490","74.125.207.16","10.0.2.15","TLSv1.2","103","Application Data"
"259","80.044515","10.0.2.15","74.125.207.16","TCP","54","48939  >  465 [ACK] Seq=698 Ack=508 Win=31088 Len=0"
"260","80.045398","10.0.2.15","74.125.207.16","TLSv1.2","125","Application Data"
"261","80.045732","74.125.207.16","10.0.2.15","TCP","60","465  >  48939 [ACK] Seq=508 Ack=769 Win=65535 Len=0"
"262","80.098594","74.125.207.16","10.0.2.15","TLSv1.2","124","Application Data"
"263","80.102774","10.0.2.15","131.202.240.87","UDP","45","49539  >  53828 Len=3"
"264","80.121678","10.0.2.15","74.125.207.16","TLSv1.2","114","Application Data"
"265","80.122014","74.125.207.16","10.0.2.15","TCP","60","465  >  48939 [ACK] Seq=578 Ack=829 Win=65535 Len=0"
"266","80.170893","74.125.207.16","10.0.2.15","TLSv1.2","124","Application Data"
"267","80.206900","10.0.2.15","74.125.207.16","TLSv1.2","89","Application Data"
"268","80.207155","74.125.207.16","10.0.2.15","TCP","60","465  >  48939 [ACK] Seq=648 Ack=864 Win=65535 Len=0"
"269","80.297407","74.125.207.16","10.0.2.15","TLSv1.2","125","Application Data"
"270","80.298926","10.0.2.15","74.125.207.16","TLSv1.2","906","Application Data"
"271","80.299126","74.125.207.16","10.0.2.15","TCP","60","465  >  48939 [ACK] Seq=719 Ack=1716 Win=65535 Len=0"
"272","80.765099","74.125.207.16","10.0.2.15","TLSv1.2","135","Application Data"
"273","80.778474","10.0.2.15","74.125.207.16","TLSv1.2","89","Application Data"
"274","80.779885","74.125.207.16","10.0.2.15","TCP","60","465  >  48939 [ACK] Seq=800 Ack=1751 Win=65535 Len=0"
"275","80.833460","74.125.207.16","10.0.2.15","TLSv1.2","140","Application Data"
"276","80.833493","74.125.207.16","10.0.2.15","TCP","60","465  >  48939 [FIN, ACK] Seq=886 Ack=1751 Win=65535 Len=0"
"277","80.845347","10.0.2.15","74.125.207.16","TLSv1.2","85","Encrypted Alert"
"278","80.845479","10.0.2.15","74.125.207.16","TCP","54","48939  >  465 [FIN, ACK] Seq=1782 Ack=887 Win=31088 Len=0"
"279","80.846091","74.125.207.16","10.0.2.15","TCP","60","465  >  48939 [ACK] Seq=887 Ack=1782 Win=65535 Len=0"
"280","80.846118","74.125.207.16","10.0.2.15","TCP","60","465  >  48939 [ACK] Seq=887 Ack=1783 Win=65535 Len=0"
"281","80.850160","10.0.2.15","64.233.181.16","TLSv1.2","91","Application Data"
"282","80.851094","64.233.181.16","10.0.2.15","TCP","60","993  >  39536 [ACK] Seq=1341 Ack=1139 Win=65535 Len=0"
"283","80.971915","64.233.181.16","10.0.2.15","TLSv1.2","128","Application Data, Application Data"
"284","80.971985","10.0.2.15","64.233.181.16","TCP","54","39536  >  993 [ACK] Seq=1139 Ack=1415 Win=65535 Len=0"
"285","80.980486","10.0.2.15","64.233.181.16","TLSv1.2","98","Application Data"
"286","80.982506","64.233.181.16","10.0.2.15","TCP","60","993  >  39536 [ACK] Seq=1415 Ack=1183 Win=65535 Len=0"
"287","81.031112","64.233.181.16","10.0.2.15","TLSv1.2","92","Application Data"
"288","81.032127","10.0.2.15","64.233.181.16","TLSv1.2","123","Application Data"
"289","81.032595","64.233.181.16","10.0.2.15","TCP","60","993  >  39536 [ACK] Seq=1453 Ack=1252 Win=65535 Len=0"
"290","81.052986","10.0.2.15","64.233.181.16","TLSv1.2","91","Application Data"
"291","81.053523","64.233.181.16","10.0.2.15","TCP","60","993  >  39536 [ACK] Seq=1453 Ack=1289 Win=65535 Len=0"
"292","81.579265","64.233.181.16","10.0.2.15","TLSv1.2","132","Application Data, Application Data"
"293","81.581079","10.0.2.15","64.233.181.16","TLSv1.2","93","Application Data"
"294","81.581255","64.233.181.16","10.0.2.15","TCP","60","993  >  39536 [ACK] Seq=1531 Ack=1328 Win=65535 Len=0"
"295","81.631718","64.233.181.16","10.0.2.15","TLSv1.2","93","Application Data"
"296","81.670249","10.0.2.15","64.233.181.16","TCP","54","39536  >  993 [ACK] Seq=1328 Ack=1570 Win=65535 Len=0"
"297","81.806493","10.0.2.15","64.233.181.16","TLSv1.2","93","Application Data"
"298","81.807014","64.233.181.16","10.0.2.15","TCP","60","993  >  39536 [ACK] Seq=1570 Ack=1367 Win=65535 Len=0"
"299","81.858737","64.233.181.16","10.0.2.15","TLSv1.2","93","Application Data"
"300","81.858772","10.0.2.15","64.233.181.16","TCP","54","39536  >  993 [ACK] Seq=1367 Ack=1609 Win=65535 Len=0"
"301","81.862678","10.0.2.15","64.233.181.16","TLSv1.2","93","Application Data"
"302","81.863109","64.233.181.16","10.0.2.15","TCP","60","993  >  39536 [ACK] Seq=1609 Ack=1406 Win=65535 Len=0"
"303","81.916846","64.233.181.16","10.0.2.15","TLSv1.2","98","Application Data"
"304","81.917668","10.0.2.15","64.233.181.16","TLSv1.2","94","Application Data"
"305","81.917837","64.233.181.16","10.0.2.15","TCP","60","993  >  39536 [ACK] Seq=1653 Ack=1446 Win=65535 Len=0"
"306","81.983269","64.233.181.16","10.0.2.15","TLSv1.2","112","Application Data"
"307","81.986313","10.0.2.15","64.233.181.16","TLSv1.2","98","Application Data"
"308","81.986691","64.233.181.16","10.0.2.15","TCP","60","993  >  39536 [ACK] Seq=1711 Ack=1490 Win=65535 Len=0"
"309","82.049626","64.233.181.16","10.0.2.15","TLSv1.2","184","Application Data, Application Data"
"310","82.090284","10.0.2.15","64.233.181.16","TCP","54","39536  >  993 [ACK] Seq=1490 Ack=1841 Win=65535 Len=0"
"311","82.099039","10.0.2.15","64.233.181.16","TLSv1.2","94","Application Data"
"312","82.099426","64.233.181.16","10.0.2.15","TCP","60","993  >  39536 [ACK] Seq=1841 Ack=1530 Win=65535 Len=0"
"313","82.149803","64.233.181.16","10.0.2.15","TLSv1.2","92","Application Data"
"314","82.149833","10.0.2.15","64.233.181.16","TCP","54","39536  >  993 [ACK] Seq=1530 Ack=1879 Win=65535 Len=0"
"315","105.342400","64.233.183.16","10.0.2.15","TLSv1.2","95","Application Data"
"316","105.342490","10.0.2.15","64.233.183.16","TCP","54","43558  >  993 [ACK] Seq=355 Ack=2135 Win=65535 Len=0"
"317","105.344600","10.0.2.15","64.233.183.16","TLSv1.2","91","Application Data"
"318","105.344786","64.233.183.16","10.0.2.15","TCP","60","993  >  43558 [ACK] Seq=2135 Ack=392 Win=65535 Len=0"
"319","105.393119","64.233.183.16","10.0.2.15","TLSv1.2","95","Application Data"
"320","105.393693","10.0.2.15","64.233.183.16","TLSv1.2","94","Application Data"
"321","105.393886","64.233.183.16","10.0.2.15","TCP","60","993  >  43558 [ACK] Seq=2176 Ack=432 Win=65535 Len=0"
"322","105.620472","64.233.183.16","10.0.2.15","TLSv1.2","94","Application Data"
"323","105.621252","10.0.2.15","64.233.183.16","TLSv1.2","95","Application Data"
"324","105.621428","64.233.183.16","10.0.2.15","TCP","60","993  >  43558 [ACK] Seq=2216 Ack=473 Win=65535 Len=0"
"325","105.675111","64.233.183.16","10.0.2.15","TLSv1.2","100","Application Data"
"326","105.675623","10.0.2.15","64.233.183.16","TLSv1.2","98","Application Data"
"327","105.675830","64.233.183.16","10.0.2.15","TCP","60","993  >  43558 [ACK] Seq=2262 Ack=517 Win=65535 Len=0"
"328","105.730743","64.233.183.16","10.0.2.15","TLSv1.2","103","Application Data"
"329","105.731128","64.233.183.16","10.0.2.15","TLSv1.2","94","Application Data"
"330","105.731183","10.0.2.15","64.233.183.16","TCP","54","43558  >  993 [ACK] Seq=517 Ack=2351 Win=65535 Len=0"
"331","105.738116","10.0.2.15","64.233.183.16","TLSv1.2","99","Application Data"
"332","105.738577","64.233.183.16","10.0.2.15","TCP","60","993  >  43558 [ACK] Seq=2351 Ack=562 Win=65535 Len=0"
"333","105.795348","64.233.183.16","10.0.2.15","TLSv1.2","101","Application Data"
"334","105.795586","64.233.183.16","10.0.2.15","TLSv1.2","173","Application Data, Application Data"
"335","105.795656","10.0.2.15","64.233.183.16","TCP","54","43558  >  993 [ACK] Seq=562 Ack=2517 Win=65535 Len=0"
"336","105.807065","10.0.2.15","64.233.183.16","TLSv1.2","96","Application Data"
"337","105.807268","64.233.183.16","10.0.2.15","TCP","60","993  >  43558 [ACK] Seq=2517 Ack=604 Win=65535 Len=0"
"338","105.816107","10.0.2.15","64.4.23.162","TCP","56","46839  >  40019 [PSH, ACK] Seq=35 Ack=5 Win=64800 Len=2"
"339","105.816434","64.4.23.162","10.0.2.15","TCP","60","40019  >  46839 [ACK] Seq=5 Ack=37 Win=65535 Len=0"
"340","105.867161","64.233.183.16","10.0.2.15","TLSv1.2","117","Application Data"
"341","105.867539","64.233.183.16","10.0.2.15","TLSv1.2","741","Application Data, Application Data, Application Data, Application Data"
"342","105.868310","10.0.2.15","64.233.183.16","TCP","54","43558  >  993 [ACK] Seq=604 Ack=3267 Win=65535 Len=0"
"343","105.925264","10.0.2.15","64.233.183.16","TLSv1.2","98","Application Data"
"344","105.925645","64.233.183.16","10.0.2.15","TCP","60","993  >  43558 [ACK] Seq=3267 Ack=648 Win=65535 Len=0"
"345","105.987698","64.233.183.16","10.0.2.15","TLSv1.2","140","Application Data, Application Data"
"346","106.026255","10.0.2.15","64.233.183.16","TCP","54","43558  >  993 [ACK] Seq=648 Ack=3353 Win=65535 Len=0"
"347","106.220972","10.0.2.15","64.233.183.16","TLSv1.2","94","Application Data"
"348","106.221318","64.233.183.16","10.0.2.15","TCP","60","993  >  43558 [ACK] Seq=3353 Ack=688 Win=65535 Len=0"
"349","106.271641","64.233.183.16","10.0.2.15","TLSv1.2","92","Application Data"
"350","106.271712","10.0.2.15","64.233.183.16","TCP","54","43558  >  993 [ACK] Seq=688 Ack=3391 Win=65535 Len=0"
"351","116.657852","64.233.183.16","10.0.2.15","TLSv1.2","95","Application Data"
"352","116.657934","10.0.2.15","64.233.183.16","TCP","54","43558  >  993 [ACK] Seq=688 Ack=3432 Win=65535 Len=0"
"353","116.659539","10.0.2.15","64.233.183.16","TLSv1.2","91","Application Data"
"354","116.659721","64.233.183.16","10.0.2.15","TCP","60","993  >  43558 [ACK] Seq=3432 Ack=725 Win=65535 Len=0"
"355","116.709963","64.233.183.16","10.0.2.15","TLSv1.2","94","Application Data"
"356","116.711342","10.0.2.15","64.233.183.16","TLSv1.2","94","Application Data"
"357","116.711572","64.233.183.16","10.0.2.15","TCP","60","993  >  43558 [ACK] Seq=3472 Ack=765 Win=65535 Len=0"
"358","116.760707","64.233.183.16","10.0.2.15","TLSv1.2","94","Application Data"
"359","116.765724","10.0.2.15","64.233.183.16","TLSv1.2","94","Application Data"
"360","116.765972","64.233.183.16","10.0.2.15","TCP","60","993  >  43558 [ACK] Seq=3512 Ack=805 Win=65535 Len=0"
"361","116.822983","64.233.183.16","10.0.2.15","TLSv1.2","99","Application Data"
"362","116.823694","10.0.2.15","64.233.183.16","TLSv1.2","99","Application Data"
"363","116.823964","64.233.183.16","10.0.2.15","TCP","60","993  >  43558 [ACK] Seq=3557 Ack=850 Win=65535 Len=0"
"364","116.879728","64.233.183.16","10.0.2.15","TLSv1.2","105","Application Data"
"365","116.880053","64.233.183.16","10.0.2.15","TLSv1.2","94","Application Data"
"366","116.880133","10.0.2.15","64.233.183.16","TCP","54","43558  >  993 [ACK] Seq=850 Ack=3648 Win=65535 Len=0"
"367","116.882446","10.0.2.15","64.233.183.16","TLSv1.2","100","Application Data"
"368","116.883029","64.233.183.16","10.0.2.15","TCP","60","993  >  43558 [ACK] Seq=3648 Ack=896 Win=65535 Len=0"
"369","116.941331","64.233.183.16","10.0.2.15","TLSv1.2","219","Application Data, Application Data, Application Data"
"370","116.951796","10.0.2.15","64.233.183.16","TLSv1.2","97","Application Data"
"371","116.952035","64.233.183.16","10.0.2.15","TCP","60","993  >  43558 [ACK] Seq=3813 Ack=939 Win=65535 Len=0"
"372","117.015853","64.233.183.16","10.0.2.15","TLSv1.2","600","Application Data, Application Data"
"373","117.015999","64.233.183.16","10.0.2.15","TLSv1.2","223","Application Data, Application Data"
"374","117.017894","10.0.2.15","64.233.183.16","TCP","54","43558  >  993 [ACK] Seq=939 Ack=4528 Win=65535 Len=0"
"375","117.073608","10.0.2.15","64.233.183.16","TLSv1.2","98","Application Data"
"376","117.074417","64.233.183.16","10.0.2.15","TCP","60","993  >  43558 [ACK] Seq=4528 Ack=983 Win=65535 Len=0"
"377","117.140965","64.233.183.16","10.0.2.15","TLSv1.2","104","Application Data"
"378","117.178246","10.0.2.15","64.233.183.16","TCP","54","43558  >  993 [ACK] Seq=983 Ack=4578 Win=65535 Len=0"
"379","117.581321","10.0.2.15","64.233.183.16","TLSv1.2","94","Application Data"
"380","117.581811","64.233.183.16","10.0.2.15","TCP","60","993  >  43558 [ACK] Seq=4578 Ack=1023 Win=65535 Len=0"
"381","117.630313","64.233.183.16","10.0.2.15","TLSv1.2","92","Application Data"
"382","117.630339","10.0.2.15","64.233.183.16","TCP","54","43558  >  993 [ACK] Seq=1023 Ack=4616 Win=65535 Len=0"
"383","119.321450","10.0.2.15","74.125.207.16","TCP","74","48940  >  465 [SYN] Seq=0 Win=29200 Len=0 MSS=1460 SACK_PERM=1 TSval=4244363 TSecr=0 WS=128"
"384","119.322833","10.0.2.15","198.7.63.141","DNS","79","Standard query 0x2dbc A smtp.googlemail.com"
"385","119.322994","10.0.2.15","78.46.223.24","DNS","79","Standard query 0x2dbc A smtp.googlemail.com"
"386","119.323411","10.0.2.15","78.46.223.24","DNS","79","Standard query 0xd2cb AAAA smtp.googlemail.com"
"387","119.373032","74.125.207.16","10.0.2.15","TCP","60","465  >  48940 [SYN, ACK] Seq=0 Ack=1 Win=65535 Len=0 MSS=1460"
"388","119.373109","10.0.2.15","74.125.207.16","TCP","54","48940  >  465 [ACK] Seq=1 Ack=1 Win=29200 Len=0"
"389","119.373313","10.0.2.15","74.125.207.16","TLSv1.2","571","Client Hello"
"390","119.374428","74.125.207.16","10.0.2.15","TCP","60","465  >  48940 [ACK] Seq=1 Ack=518 Win=65535 Len=0"
"391","119.383413","198.7.63.141","10.0.2.15","DNS","270","Standard query response 0x2dbc A smtp.googlemail.com CNAME googlemail-smtp.l.google.com A 74.125.207.16 NS ns2.google.com NS ns3.google.com NS ns1.google.com NS ns4.google.com A 216.239.32.10 A 216.239.34.10 A 216.239.36.10 A 216.239.38.10"
"392","119.423697","74.125.207.16","10.0.2.15","TLSv1.2","191","Server Hello, Change Cipher Spec, Encrypted Handshake Message"
"393","119.423773","10.0.2.15","74.125.207.16","TCP","54","48940  >  465 [ACK] Seq=518 Ack=138 Win=30016 Len=0"
"394","119.424635","10.0.2.15","74.125.207.16","TLSv1.2","105","Change Cipher Spec, Encrypted Handshake Message"
"395","119.424939","74.125.207.16","10.0.2.15","TCP","60","465  >  48940 [ACK] Seq=138 Ack=569 Win=65535 Len=0"
"396","119.471155","78.46.223.24","10.0.2.15","DNS","282","Standard query response 0xd2cb AAAA smtp.googlemail.com CNAME googlemail-smtp.l.google.com AAAA 2a00:1450:400c:c04::10 NS ns1.google.com NS ns3.google.com NS ns4.google.com NS ns2.google.com A 216.239.32.10 A 216.239.34.10 A 216.239.36.10 A 216.239.38.10"
